31,20,1,Soltero,"Iztapalapa ","Licenciatura Incompleta","Escuela Nacional de Medicina y Homeopatia ","Solo estudio","Mi padre/madre o tutor",1,1,1,3,3,"Servicio de televisión por cable o satelital, Suscripción a plataformas de streaming de video (Netflix, Disney+, etc.), Suscripción a plataformas de streaming de música (Spotify, Apple Music, etc.)","Licenciatura Completa","3-4 personas","1-2 personas",3,"3-4 personas",3,0,3,3,0,3,1,2,3,"Cancha de mi deporte",0,"No me interesa","Sin consumo",0,0,0,0,0,0,0,0,0,"Sin consumo",0,Ninguna,3,"Limpio mi casa, tarea e ir a la escuela","Pop, Reggaeton, Corridos tumbados","Morat, Humbe y Kevin Kaarl","Me gustan","En casa, En la universidad, En el transporte público, Mientras hago ejercicio, En reuniones o fiestas",1,Spotify,3,0,1,2,"Amigos, Redes sociales, Playlists o algoritmos de plataformas","Solo las seleccionadas",1,"La letra ","Si es entretenido",3,3,1,1,3,1,"Instagram, TikTok","Valeria Rojas, Nicole Agnesi, Belcast","No tengo",1,Anime,"Me gusta mucho",3,1,"Morat, Humbe, Kevin Kaarl","Me identifico con su música o sus letras, Me gusta su estilo de vida o su historia personal, Han impactado mi vida de alguna forma, Me gusta su imagen o estética","Las seleccionadas",4,3,0,1,0,3,0,1,0,0,"Instagram, Tik Tok, Youtube",3,"Me gusta su música, Me interesa su vida personal, Quiero estar al día con sus novedades","No se",1,1,"Conciertos grautitos",2,1,1,3,3,3,0,0,0,1,3,3,3,3,"Ninguno otro",Spotify
32,20,0,Soltero,Iztapalapa,"Preparatoria Completa","UAM Xochimilco","Solo estudio","Mi padre/madre o tutor",1,2,1,3,5,"Servicio de televisión por cable o satelital, Suscripción a plataformas de streaming de video (Netflix, Disney+, etc.), Suscripción a plataformas de streaming de música (Spotify, Apple Music, etc.)","Preparatoria Incompleta","5 o más personas","3-4 personas",4,"3-4 personas",2,0,3,0,2,1,1,1,3,"Deportivos, encuentros deportivos, parques",1,"Porque disfruto de la experiencia que me generan","Nba2K, F1 y LOL",2,1,1,2,3,1,2,0,1,"Playstation, Celular",1,"Mi playlist variada",2,"Todas en las que pueda estar escuchando música ","Hiphop, Reggaeton, Corridos tumbados","Duki, Wos y Natanael Cano","Son artistas que han impactado en mi vida ","En casa, En la universidad, En el transporte público, En transporte propio, Mientras hago ejercicio, En reuniones o fiestas",3,"Apple Music",3,3,1,1,"Redes sociales, Playlists o algoritmos de plataformas, Colaboraciones con artistas que escucho","Por lo que llego a ver en la tele",2,"La letra y el ritmo ","La fotografía y la hsitoria",3,3,0,3,2,3,"Instagram, TikTok, YouTube","Andamos reaccionando, Josedeodo y collegemania cfb","Considero que ninguno",1,"De la música, el futbol americano y la lucha libre","Porque me dan mucha alegría y me traen pasion al hacerlo",5,1,"Duki, C-kan y Wos","Me identifico con su música o sus letras, Me gusta su estilo de vida o su historia personal, Por la interacción que tienen con los fans, Han impactado mi vida de alguna forma","Por las historias que han hecho en mi vida",3,1,1,2,1,3,2,0,3,3,"Instagram, Tik Tok, Facebook, Youtube, Twitch",3,"Me gusta su música, Quiero estar al día con sus novedades, Por las dinámicas o concursos que realizan","Sin motivos",1,1,"Un M&G para conocerlos y tener un concierto ",2,1,1,1,1,1,1,1,1,1,1,2,1,1,Ninguno,"Under Armour"
33,20,1,Soltero,"Miguel Hidalgo","Licenciatura Incompleta","FES Acatlán ","Solo estudio","Mi padre/madre o tutor",1,2,2,2,1,"Suscripción a plataformas de streaming de video (Netflix, Disney+, etc.)","Licenciatura Completa","3-4 personas","1-2 personas",3,"3-4 personas",3,0,3,3,2,2,2,2,3,"Cine ",0,"No tengo mucho tiempo ","Sin consumo",0,0,0,0,0,0,0,0,0,"Sin consumo",0,"Si jugará, sería kpop ",3,"Tarea, el aseo, mientras me maquillo, etc.","Pop, Hiphop, Kpop","BTS, Charlie Puth, Agust D","Porque me gusta las letras de sus canciones, lo cual me ayuda para hacer mis cosas ","En casa, En la universidad, En el transporte público, En transporte propio, Mientras hago ejercicio",3,"Spotify, Apple Music, YouTube Music, Amazon Music, Deezer",3,3,3,3,"Amigos, Redes sociales, Playlists o algoritmos de plataformas, Estaciones de radio, Tendencias",/,3,"La letra y las melodías qué tienen ","La historia, ya que muchos video tienen una historia dentro del video musical ",3,3,3,3,3,2,"Instagram, TikTok, Twitter/X, YouTube",/,"Yeri mua ",1,BTS,"Porque llegaron en un momento ds mi vida que fue importante ",5,1,BTS,"Me identifico con su música o sus letras, Me gusta su estilo de vida o su historia personal, Por la interacción que tienen con los fans, Han impactado mi vida de alguna forma",/,5,3,2,3,3,3,3,2,3,2,"Instagram, Tik Tok, Youtube, X",3,"Me gusta su música, Quiero estar al día con sus novedades, Me gusta cómo interactúan con sus seguidores","Si han hecho algo cuestionable, y que se meta en problemas legales serios ",1,1,"Conciertos ",2,3,3,3,3,2,3,3,3,3,3,3,3,3,"Membresías ","Escuchar música"
34,20,1,Soltero,"Cuauhtémoc ","Licenciatura Incompleta","Facultad de Estudios Superiores Acatlán ","Solo estudio","Mi padre/madre o tutor",1,1,0,1,3,"Suscripción a plataformas de streaming de video (Netflix, Disney+, etc.)","Secundaria Completa","3-4 personas","1-2 personas",2,"1-2 personas",2,0,2,1,1,2,0,1,3,"Las plazas comerciales ",0,"No tengo donde jugar ","Sin consumo",0,0,0,0,0,0,0,0,0,"Sin consumo",0,"Ninguna ",1,"Voy en el transporte público o cuándo estoy lavando ropa ","Reggaeton, Salsa, Corridos","Romeo santos, Jhay cortes, bad bunny","Me gusta el género que cantan ","En casa, En el transporte público, Mientras hago ejercicio, En reuniones o fiestas",2,"Spotify, YouTube Music",3,1,1,0,"Amigos, Redes sociales, Tendencias, Colaboraciones con artistas que escucho","Cuando las escucho en fiestas ",2,"La producción ","La producción ",3,3,1,3,3,2,TikTok,"Quesito Quezada, Lupita Villalobos ",.,0,"Sin fanatismo","No aplica",0,1,"Aleman, bad bunny, anuel ","Me identifico con su música o sus letras, Me gusta su estilo de vida o su historia personal","Porque me gusta como cantan ",3,1,1,1,1,1,1,1,1,1,"Instagram, Tik Tok",3,"Me gusta su música, Me interesa su vida personal, Me gustan sus contenidos exclusivos (videos, fotos, etc.)","Algún chisme malo de ellos ",0,1,"Conciertos gratis ",1,1,2,2,1,1,1,2,0,2,3,1,2,2,"Solo esos ",Nike
35,20,0,Soltero,"Azcapotzalco ","Licenciatura Incompleta","En la UNAM ","Solo estudio","Mi padre/madre o tutor",1,1,2,4,4,"Servicio de televisión por cable o satelital, Suscripción a plataformas de streaming de video (Netflix, Disney+, etc.), Suscripción a plataformas de streaming de música (Spotify, Apple Music, etc.)","Licenciatura Completa","3-4 personas","1-2 personas",3,"3-4 personas",3,2,3,2,3,3,3,2,3,"Plazas ",1,"Me gusta ganar ","Overwatch 
Mario party 
Splatoon",3,3,3,3,3,3,3,3,3,"Playstation, Nintendo, Celular, PC, Tablet o Ipad",1,Kpop,3,"Quehacer ","Pop, R&b, Kpop","Twice, Kenia os, Sabrina carpinter","Porque me gustan mucho la versatilidad de las artistas  ","En casa, En la universidad, En el transporte público, Mientras hago ejercicio",3,Spotify,3,2,2,2,"Redes sociales","TikTok ",3,"Un buen puente ","Que no tenga diálogos ",3,3,3,3,3,3,"Instagram, TikTok, YouTube, Facebook","Karen Polinesia 
Lesly polinesia 
Rafa polinesio","Kimberly loaiza
Juan de Dios Pantoja 
Súper trucha ",1,"Kpop ","Por sus coreografías  ",3,1,"Twice, kep1er, Newjeans ","Me identifico con su música o sus letras, Me gusta su estilo de vida o su historia personal, Por la interacción que tienen con los fans, Han impactado mi vida de alguna forma, Me gusta su imagen o estética","Por los atuendos ",3,3,3,3,3,3,3,3,3,3,"Instagram, Tik Tok, Facebook, Youtube, X",4,"Me gusta su música, Me interesa su vida personal, Me gusta cómo interactúan con sus seguidores","Que sean mamones ",1,1,"Un pícnic ",3,3,3,3,3,3,3,3,3,3,3,3,3,3,"No se ","Nintendo "
36,20,0,Soltero,"Cuautitlan Mexico","Licenciatura Incompleta","Universidad UNAM FES ARAGON","Solo estudio","Mi padre/madre o tutor",1,1,0,0,3,"Suscripción a plataformas de streaming de música (Spotify, Apple Music, etc.)","Licenciatura Completa","5 o más personas","1-2 personas",2,"5 o más personas",3,0,2,2,2,2,3,3,3,"Mi cuarto",1,"Me gusta mucho el Hobby","Minecraft Valorant LOL",2,3,3,3,2,3,2,2,2,"Nintendo, PC",1,R&B,3,"Cuando salgo, estudio, entreno, en todos lados","Hiphop, R&b, Salsa","Kendrick Lamar, Ye, Tyler","Por el arte que han hecho","En casa, En la universidad, En el trabajo, En el transporte público, En transporte propio, Mientras hago ejercicio, En reuniones o fiestas",3,Spotify,3,0,0,2,"Familia, Amigos, Redes sociales, Playlists o algoritmos de plataformas, Tendencias, Colaboraciones con artistas que escucho","Por redes sociales (Youtube y TikTok)",1,"Que sea de calidad, tenga un concepto, sea propositiva ","Que el video sea acorde a la musica y el corte sea bueno ",3,2,0,3,1,2,"Instagram, TikTok, YouTube","DobleR MusicDelaer Yadmor",.,1,"La musica y la tecnología ","Por que me hacen sentir vivo",5,1,"Kendrick, Ye, Tyler","Me identifico con su música o sus letras, Me gusta su estilo de vida o su historia personal, Han impactado mi vida de alguna forma, Me gusta su imagen o estética","Por lo que han aportado a la musica",4,0,0,2,0,3,1,0,3,0,Instagram,2,"Me gusta su música, Quiero estar al día con sus novedades, Me gustan sus contenidos exclusivos (videos, fotos, etc.)","Por que no son activos o por que me dejo de interesar ",0,1,"Listening Party",3,1,1,1,1,2,0,0,0,1,2,2,2,2,"Merch en conciertoz",Apple
37,20,1,Soltero,"Gustavo A. Madero","Preparatoria Completa",UNAM,"Estudio y trabajo medio tiempo","Mi padre/madre o tutor",1,2,4,3,4,"Suscripción a plataformas de streaming de video (Netflix, Disney+, etc.), Suscripción a plataformas de streaming de música (Spotify, Apple Music, etc.)","Licenciatura Incompleta","3-4 personas","1-2 personas",3,"3-4 personas",3,1,2,3,0,3,2,2,3,Cafeterias,1,"Diversión ",Warzone,1,3,2,1,0,3,3,3,0,Playstation,1,R&B,1,"transpórtame hacia algún lugar","Pop, R&b, Indie Pop, Trap","Daniel Caesar, Méne, Ariana Grnade","me gustan las letras de sus canciones, ritmo y esencia","En casa, En la universidad, En el transporte público, Mientras hago ejercicio",3,"Apple Music, YouTube Music",3,2,1,2,"Amigos, Redes sociales, Playlists o algoritmos de plataformas, Tendencias, Colaboraciones con artistas que escucho",TikTok,2,"El beta de la canción y su letra","Que tenga buena producción y una historia acorde a la canción ",3,3,1,3,1,1,"Instagram, TikTok","Jenny Barro, Lisa Onuoha y Emma Chamberlain ","No tengo uno en especifico",1,"Sagas de películas y series ","Por la historia que cuentan ",3,1,"Álvaro Díaz, Nsqk, Block Party","Me identifico con su música o sus letras, Han impactado mi vida de alguna forma","Sus álbumes o canciones han llegado en momentos en los que necesitaba escuchar su música haciéndome sentir identificada con ellos",3,0,0,2,0,2,0,0,0,0,"Instagram, Tik Tok, Youtube",3,"Me gusta su música, Me gusta cómo interactúan con sus seguidores, Me gustan sus contenidos exclusivos (videos, fotos, etc.)","Aveces suben mucho contenido de su vida diaria",1,1,"un listening party ",2,1,2,1,1,2,1,0,0,1,3,2,1,2,"llaveros ","Frituras "
38,20,0,Soltero,"Atizapán ","Carrera técnica completa","ESIME Azcapotzalco IPN","Estudio y trabajo medio tiempo","Mi padre/madre o tutor",1,1,1,1,2,"Suscripción a plataformas de streaming de video (Netflix, Disney+, etc.)","Preparatoria Completa","3-4 personas","3-4 personas",1,"1-2 personas",2,0,3,2,2,1,0,0,3,"Museos o áreas recreativas ",1,"Eliminar la ansiedad y distraerme un poco. ","Fortnite, Evil Nun y Roblox ",3,3,3,3,0,3,3,3,3,"Celular, PC",1,"Depende el juego, varía desde el ritmo más tranquilo como "jazz" hasta el más movido como "rock" ",2,"Tarea escolar, ejercicio, cocinar y trabajar","Rock, Jazz, Salsa","Kid Laroi, José José y My Chemical Romance ","Encuentro ritmos que van de acuerdo a mi estilo de vida.c","En casa, En la universidad, En el trabajo, En el transporte público, En transporte propio, Mientras hago ejercicio",3,Spotify,3,1,0,2,"Familia, Amigos, Playlists o algoritmos de plataformas","Por soundtracks de videojuegos ",2,"Su ritmo, letra y sentimiento que lleva. ","Qué la trama concuerde con la canción. ",3,2,1,1,3,0,"Instagram, TikTok, Facebook","El Mariana, Hombre Nuevo y Estilo de vida. ","Me es indistinto pues no conozco muchos influencers ",1,"De los videojuegos y del ejercicio ","Me es sencillo desenvolverme en el tema. ",5,1,"BTS, Ghost y Cigarettes After Sex ","Me identifico con su música o sus letras, Me gusta su estilo de vida o su historia personal, Han impactado mi vida de alguna forma","Son ritmos bastante variados y esos mismos nunca faltan en mis días, por tal motivo siempre están presentes ",2,2,0,2,0,0,0,0,0,0,"Instagram, Facebook",2,"Me gusta su música, Me gustan sus contenidos exclusivos (videos, fotos, etc.)","El contenido ",0,0,"No tengo alguna en mente ",0,0,2,3,0,2,0,0,0,0,0,2,0,3,"Ya mencionados. ","Algunos productos como nueces (de todo tipo) karate, Hot Nuts, etc "
39,20,1,Soltero,"Venustiano Carranza","Licenciatura Incompleta","Tecnólogico de Monterrey","Estudio y trabajo medio tiempo","Mi padre/madre o tutor",1,3,3,2,5,"Servicio de televisión por cable o satelital, Suscripción a plataformas de streaming de video (Netflix, Disney+, etc.), Suscripción a plataformas de streaming de música (Spotify, Apple Music, etc.)","Licenciatura Incompleta","5 o más personas","5 o más personas",5,"5 o más personas",5,0,0,0,0,0,3,2,3,Restaurantes,0,"Nunca me han llamado la atención","Sin consumo",0,0,0,0,0,0,0,0,0,"Sin consumo",0,"no escucho",2,Conducir,"Reggaeton, Kpop, Baladas","CD9, BTS y Emilia","Me gusta su historia y su manera de conectar con las fans. ","En casa, En la universidad, En el trabajo, En el transporte público, En transporte propio, En reuniones o fiestas",3,"Apple Music, Apple music",3,0,0,0,"Amigos, Redes sociales, Estaciones de radio","en clase",2,"su letrq","una historia, que tengan sentido",3,3,2,2,3,1,"Instagram, TikTok, YouTube, Facebook","Nicole Agnesi, Skabeche, y Majo Rivas","El temach",0,"Sin fanatismo","No aplica",0,1,"cd9 o bts","Me identifico con su música o sus letras, Me gusta su estilo de vida o su historia personal, Por la interacción que tienen con los fans","amo su personalidad",3,2,0,0,0,1,3,0,1,0,"Instagram, Tik Tok, Facebook, Youtube, X",4,"Me gusta su música, Me interesa su vida personal, Me gusta cómo interactúan con sus seguidores, Me gustan sus contenidos exclusivos (videos, fotos, etc.)","No me gusta sus creencias",1,1,"Meet and greet después de los conciertos",3,0,0,1,0,0,0,0,2,0,1,1,0,0,"más que nada conciertos y experiencias con ellos","la comida o gomitas para distraerme"
40,20,1,Soltero,Coyoacán,"Licenciatura Incompleta",UNAM,"Solo estudio","Mi padre/madre o tutor",1,2,3,5,5,"Servicio de televisión por cable o satelital, Suscripción a plataformas de streaming de video (Netflix, Disney+, etc.), Suscripción a plataformas de streaming de música (Spotify, Apple Music, etc.)","Licenciatura Completa","5 o más personas","3-4 personas",5,"1-2 personas",2,1,1,2,1,2,0,1,3,Restaurantes,1,"Porque me gusta","Minecraft, Roblox, COD",0,3,3,3,0,1,2,2,1,"PC, Tablet o Ipad",0,"No aplica",1,"Ver tiktok y leer","Pop, Rock","Arctic monkeys, Lana del rey, Grimes","Porque me gustan","En casa, En la universidad",2,Spotify,3,1,1,3,"Amigos, Playlists o algoritmos de plataformas, Tendencias","En tiktok",1,"Lo que transmite","El enfoque de grabación y las tomas",2,3,2,2,3,1,"TikTok, YouTube","Juan Guarnizo",Temach,1,"De arctic monkeys ","Porque me gusta",3,1,"Arctic monkeys","Me identifico con su música o sus letras, Me gusta su imagen o estética","Por su armonía ",3,1,0,2,0,1,1,0,2,0,"Instagram, Tik Tok, Facebook, Youtube, X",3,"Me gusta su música","Sus actitudes",0,1,"Más conciertos en México ",1,1,2,2,0,3,1,1,0,1,3,3,3,3,"Los que seleccioné ","no lo sé :("
41,20,1,Soltero,Teloloapan,"Licenciatura Incompleta","Universidad ","Solo estudio","Mi padre/madre o tutor",1,2,0,2,3,"Servicio de televisión por cable o satelital, Suscripción a plataformas de streaming de video (Netflix, Disney+, etc.), Suscripción a plataformas de streaming de música (Spotify, Apple Music, etc.)","Secundaria Incompleta","3-4 personas","1-2 personas",1,"1-2 personas",3,0,2,2,2,2,2,2,3,Parques,0,"Sin consumo","Sin consumo",0,0,0,0,0,0,0,0,0,"Sin consumo",0,"Taylor Swift ",2,"Labores domésticos etc..","Pop, Rock, Kpop","Taylor Swift 
Lana del rey
Olivia Rodrigo","Porque me gustan sus canciones ","En casa, En la universidad, En el transporte público, Mientras hago ejercicio",3,"Spotify, Apple Music",3,3,3,3,"Redes sociales, Playlists o algoritmos de plataformas, Tendencias, Colaboraciones con artistas que escucho, Espacios públicos, Shazam o Soundhound","En plataformas como YouTube ",3,"La letra, la melodía, el sentimiento o emoción, y la instrumentación.","La conexión con la canción y la creatividad ",3,3,3,3,3,1,TikTok,"Elan
Jair Sánchez 
Andres Johnson","Yeri mua
Dj Pantoja 
Memo Aponte ",1,"Taylor Swift ","Por sus letras profundas y personales, su evolución y versatilidad.",5,1,"Taylor Swift, Lana del rey, The 1975","Me identifico con su música o sus letras, Han impactado mi vida de alguna forma","Por su visión artística ",5,1,1,2,1,1,1,1,1,1,"Instagram, Tik Tok, Facebook, Youtube, X",2,"Me gusta su música, Me gusta cómo interactúan con sus seguidores, Me gustan sus contenidos exclusivos (videos, fotos, etc.)","Controversias o escándalos ",1,0,"Elige mi setlist ",2,2,3,2,0,3,1,0,1,1,3,3,1,3,Ninguno,"Fuze tea"
42,20,1,Soltero,"Venustiano carranza ","Licenciatura Incompleta","Facultad de ciencias políticas y sociales ","Estudio y trabajo medio tiempo","Yo pago por mis estudios",1,1,0,1,3,"Suscripción a plataformas de streaming de video (Netflix, Disney+, etc.), Suscripción a plataformas de streaming de música (Spotify, Apple Music, etc.)","Preparatoria Completa","3-4 personas","1-2 personas",2,"3-4 personas",2,0,1,3,2,2,1,2,3,"Cafeterías, plazas comerciales, cines",1,"Porque me entretengo","Valorant, Fornite, Minecraft",1,1,2,2,0,2,2,3,2,X-box,1,Pop,2,"Tarea, quehacer","Pop, Rock, R&b","Aquihayaquihay, José José, Oasis","Porque me gusta su música ","En casa, En la universidad, En el trabajo, En el transporte público, En reuniones o fiestas",3,Spotify,3,3,2,1,"Familia, Amigos, Redes sociales, Playlists o algoritmos de plataformas, Tendencias, Colaboraciones con artistas que escucho, Espacios públicos","En la radio de spotify",1,"La voz","La producción ",3,3,3,3,3,2,"TikTok, Twitter/X","Esen, Nosoloclasicos, ","Yeri Mua, Miku, Kim Loaiza",1,"De la literatura ","Porque es algo que consumo mucho y me gusta",3,0,"Sin fanatismo",,"Sin motivos",0,0,0,0,0,0,0,0,0,0,,0,"No aplica","Sin motivos",0,0,"Sin dinamica",2,0,1,0,0,0,0,0,0,0,2,2,2,2,Ninguno,"Xbox, Spotify, H&M..."
43,21,0,Soltero,"Cuautitlán Izcalli","Licenciatura Incompleta","UVM lomas verdes","Estudio y trabajo medio tiempo","Mi padre/madre o tutor",1,1,4,4,4,"Servicio de televisión por cable o satelital, Suscripción a plataformas de streaming de video (Netflix, Disney+, etc.), Suscripción a plataformas de streaming de música (Spotify, Apple Music, etc.)",Posgrado,"3-4 personas","3-4 personas",5,"1-2 personas",4,0,3,3,3,3,2,2,3,"Gym o casa de amigos",1,"Es una buena distracción ","Minecraft, Pokémon ",3,3,3,2,2,3,2,3,2,"Playstation, X-box, Nintendo, Celular, PC, Tablet o Ipad",1,"De todo un poco, más banda sonoras de videojuegos o rockindie",1,"Dibujar/ Trabajar","Pop, Rock, Baladas","Arctic Monkeys, ColdPlay,  Elton John","Me gusta mucho su estilos y letras ","En casa, En la universidad, En el trabajo, Mientras hago ejercicio",2,Spotify,3,2,2,2,"Familia, Redes sociales, Tendencias","Películas y series ",0,"El ritmo y la letra ","La producción y dirección ",3,3,2,3,3,1,TikTok,,,1,"La animación ","Es un medio que combina las audiovisuales, sin límite en la expresión o limitantes físicas ",5,1,"Imagine dragons, arctic monkeys, Coldplay ","Me identifico con su música o sus letras, Han impactado mi vida de alguna forma","Gusto personal ",5,2,2,3,2,2,2,2,3,2,"Instagram, Tik Tok, Facebook, Youtube, X",0,"Me gusta su música, Quiero estar al día con sus novedades","Desinterés en el producto ",0,1,"Regalar boletos a conciertos ",2,2,2,3,2,2,2,2,2,2,2,2,2,2,"Ninguno ","Ninguna "
44,21,0,Soltero,"Coyoacan ","Licenciatura Incompleta",Unam,"Estudio y trabajo medio tiempo","Mi padre/madre o tutor",1,4,2,2,5,"Ninguno de los anteriores","Secundaria Completa","5 o más personas","3-4 personas",4,"3-4 personas",3,1,3,1,3,3,1,1,3,"El gym o el parque",1,"Me desestrezo ","Cod mobile y genshin impact y juegos ocasionales ",3,3,3,0,0,3,0,1,0,"Celular, Tablet o Ipad",1,"De todo",2,"De todo","Reggaeton, Salsa, Duranguense","Fied, tecno y música regional","Son alegres y/o me gustan sus melodías ","En casa, En la universidad, En el trabajo, En el transporte público, En transporte propio, Mientras hago ejercicio, En reuniones o fiestas",2,"Spotify, YouTube Music, Deezer",3,1,0,3,"Familia, Amigos, Redes sociales, Playlists o algoritmos de plataformas, Estaciones de radio, Tendencias, Colaboraciones con artistas que escucho, Espacios públicos","Por memes",2,"La letra o el como me haga sentir ","El mensaje que quiera transmitir ",3,0,0,3,3,1,"Instagram, YouTube, Facebook",,,1,"De los deportes y de la música ","Me gusta practicarlo y/o me gusta el artista.",3,1,"Feid, ramstein, drake","Me identifico con su música o sus letras, Me gusta su imagen o estética","Por gustos adquiridos por el entorno social ",5,0,0,0,0,0,0,0,3,0,Instagram,0,"Me gusta su música, Quiero estar al día con sus novedades","Si empieza con contenido aburrido",0,1,"Q regala mercancía en dinámicas y q el envío fuera mundial",2,0,2,2,2,0,0,0,0,0,0,0,0,0,"Por ejemplo si colaboran con arcas ya establecidas y si em gusta lo compro","Comida rápida, ya sea pizza o lo q sea q engorde (sabritas, dominós, gamesa, Coca-Cola y etc)"
45,21,0,Soltero,"Atizapán de Zaragoza","Licenciatura Incompleta","Tec de Monterrey","Solo estudio","Mi padre/madre o tutor",1,3,2,4,4,"Suscripción a plataformas de streaming de video (Netflix, Disney+, etc.)","Licenciatura Completa","3-4 personas","1-2 personas",4,"3-4 personas",1,1,3,3,3,2,1,3,3,"La escuela, Starbucks, Crudologia (bar) y Fiestas",1,"Por qué le gusta ","LOL, Gta V y Class Royal",0,2,2,2,0,3,1,2,0,"X-box, Celular, PC, Tablet o Ipad",1,"Lo que caiga de mi playlist",1,"Ejercicio, cuando Juego, cuando hago Tareas, cuando va a fiestas ","Reggaeton, Electrónica, Corridos tumbados","Feid, Lost Frequencies y Peso Pluma","Por qué están chidos","En casa, En la universidad, En el trabajo, En el transporte público, En transporte propio, Mientras hago ejercicio, En reuniones o fiestas",2,"Apple Music, Apple music",3,2,0,2,"Amigos, Redes sociales, Playlists o algoritmos de plataformas, Estaciones de radio, Tendencias, Colaboraciones con artistas que escucho, Shazam o Soundhound","Todas las anteriores",1,"El ritmo y la ocasión ","Que tengas coherencia con la música y que esté llamativo ",3,3,2,3,2,0,TikTok,,,1,"Fórmula 1","Porque le gusta analizar los factores que pueden hacer lo que un piloto gane o pierda ",3,0,"Sin fanatismo",,"Sin motivos",0,0,0,0,0,0,0,0,0,0,,0,"No aplica","Sin motivos",0,0,"Sin dinamica",0,0,0,0,0,0,0,0,0,0,0,0,0,0,Ninguno," "
46,21,0,Soltero,"Atizapan de Zaragoza","Licenciatura Incompleta","Unitec Atizapán ","Estudio y trabajo medio tiempo","Mi padre/madre o tutor",1,2,3,4,5,"Servicio de televisión por cable o satelital, Suscripción a plataformas de streaming de video (Netflix, Disney+, etc.), Suscripción a plataformas de streaming de música (Spotify, Apple Music, etc.)",Posgrado,"1-2 personas","1-2 personas",6,"1-2 personas",5,0,2,2,3,3,2,2,2,"Estar en mi casa ",1,"Ayuda al estrés","League of legends apex legends Minecraft ",2,3,3,2,2,3,2,2,2,PC,1,"Pop en español kpop ",2,"Jugar lavar conducir ","Pop, Clásica, Kpop","Twice Vicente y Jose Jose ","Me hustab","En casa, En la universidad, En el trabajo, En transporte propio, Mientras hago ejercicio, En reuniones o fiestas",2,"Spotify, Apple Music, YouTube Music, Amazon Music, Apple music",3,3,3,3,"Familia, Amigos, Redes sociales, Playlists o algoritmos de plataformas, Estaciones de radio, Tendencias","TikTok ",3,"Que pegue al alma ","La calidad ",3,3,3,3,3,3,"Instagram, TikTok, Twitter/X, YouTube, Facebook",,,0,"Sin fanatismo","No aplica",0,0,"Sin fanatismo",,"Sin motivos",0,0,0,0,0,0,0,0,0,0,,0,"No aplica","Sin motivos",0,0,"Sin dinamica",2,2,3,3,2,3,2,2,2,3,3,3,2,2,"Llaveros o cosas así ","Papas palomitas o comida "
