62,21,0,Soltero,Iztacalco,"Licenciatura Incompleta","FES Aragón ","Solo estudio","Mi padre/madre o tutor",1,1,1,1,5,"Suscripción a plataformas de streaming de video (Netflix, Disney+, etc.)","Secundaria Incompleta","3-4 personas","1-2 personas",3,"3-4 personas",2,2,3,3,2,3,1,1,3,Bares,1,"Por diversión ","Minecraft, Sims City y Mortal Combat",0,3,3,3,1,2,3,2,2,"Playstation, X-box, Celular",1,"Pop y rock",2,"Tarea, estudio, aseo y ejercicio","Pop, R&b, Boleros","Luis Miguel, Michael Jackson y Prince","Por gusto","En casa, Mientras hago ejercicio, En reuniones o fiestas",2,"YouTube Music, Deezer",3,2,1,1,"Familia, Amigos, Redes sociales, Playlists o algoritmos de plataformas, Estaciones de radio, Espacios públicos, Shazam o Soundhound","Videojuegos y televisión ",2,"Letra, ritmo ","La historia",3,3,1,3,2,1,"TikTok, YouTube","No hay","No hay",1,"Videojuegos, anime y manga","Por entretenimiento",3,0,"Sin fanatismo",,"Sin motivos",0,0,0,0,0,0,0,0,0,0,,0,"No aplica","Sin motivos",0,0,"Sin dinamica",2,3,0,0,0,0,0,0,1,0,1,1,0,1,Ninguno,"No sé"
63,21,0,Soltero,Texcoco,"Licenciatura Incompleta","FES Aragón ","Solo estudio","Mi padre/madre o tutor",1,5,5,4,5,"Servicio de televisión por cable o satelital, Suscripción a plataformas de streaming de video (Netflix, Disney+, etc.), Suscripción a plataformas de streaming de música (Spotify, Apple Music, etc.)","Licenciatura Completa","5 o más personas","3-4 personas",5,"1-2 personas",3,0,3,3,2,2,2,1,3,"Áreas deportivas ",1,"Distracción y entretenimiento ",FC25,1,3,3,1,3,2,1,3,1,"Playstation, X-box, Nintendo, Celular, PC, Tablet o Ipad",1,"Reguetón ",2,Estudiar,"Rock, Reggaeton, Clásica","Chris MJ, Rauw Alejandro y Bad Bunny","Por la letra de sus canciones ","En casa, En la universidad, Mientras hago ejercicio",3,"Apple Music",3,2,2,1,Amigos,"En la calle",3,Ritmo,"Escenografía ",3,3,1,3,2,3,"Instagram, TikTok","No sabe",Kuno,1,Fútbol,"Por la estrategia",3,1,"Chris MJ, Rauw Alejandro y Anuel Aa","Me identifico con su música o sus letras","Por su estilo",3,2,1,1,0,3,2,1,1,1,"Instagram, Tik Tok",3,"Me gusta su música, Quiero estar al día con sus novedades","Sin motivos",1,1,Concierto,3,0,3,2,3,3,1,1,1,1,2,1,1,1,Ropa,"Adidas, nike, apple"
64,21,0,Soltero,"Naucalpan ","Licenciatura Completa","Universidad del valle de México ","Solo estudio","Mi padre/madre o tutor",1,2,2,5,5,"Servicio de televisión por cable o satelital, Suscripción a plataformas de streaming de video (Netflix, Disney+, etc.), Suscripción a plataformas de streaming de música (Spotify, Apple Music, etc.)",Posgrado,"3-4 personas","3-4 personas",6,"1-2 personas",4,2,3,1,3,3,1,1,2,"Centros de interés ",1,"Me  ayudan a pasar el tiempo ","Fortnite, The finals, The last of us ",2,3,3,3,1,2,2,1,3,Playstation,1,Phonk,1,"Tarea, ejercicio ","Pop, Reggaeton, Alternativo ","Judeline Álvaro Díaz Rosalia ","Me gusta su trayectoria y estilo ","En casa, En la universidad, Mientras hago ejercicio",3,"Spotify, Apple Music",3,3,3,2,"Playlists o algoritmos de plataformas","Tik tok ",2,"La melodía y el artista ","La originalidad ",3,3,2,2,0,3,TikTok,"Ninguno ","No consumo creadores de contenido ",0,"Sin fanatismo","No aplica",0,0,"Sin fanatismo",,"Sin motivos",0,0,0,0,0,0,0,0,0,0,,0,"No aplica","Sin motivos",0,0,"Sin dinamica",1,0,3,3,3,3,1,1,3,1,3,2,2,2,"Tenis ","Accesorios tecnológicos "
65,21,1,Soltero,"Tlalnepantla de Baz","Licenciatura Incompleta","Centro Eleia ","Estudio y trabajo medio tiempo","Mi padre/madre o tutor",1,5,3,5,3,"Suscripción a plataformas de streaming de video (Netflix, Disney+, etc.), Suscripción a plataformas de streaming de música (Spotify, Apple Music, etc.)",Posgrado,"1-2 personas","1-2 personas",6,"3-4 personas",4,1,1,2,1,2,2,2,3,"Plazas ",1,"Me parecen entretenidos y me distraen ","Little nightmares y Zelda ",1,2,2,2,0,1,1,1,0,"X-box, Nintendo, Tablet o Ipad",0,"No aplica",2,"Manejo, camino o cocino ","Pop, Metal, Indie","Maneskin bring me the horizon y 5SOS","Me gusta la melodía ","En casa, En la universidad, En transporte propio, Mientras hago ejercicio, En reuniones o fiestas",3,Spotify,3,3,3,3,"Amigos, Playlists o algoritmos de plataformas",Tiktok,0,"La letra y la melodía ","No veo videos musicales ",3,3,2,2,2,1,TikTok,"Olisunvia, Alice Capelle y la perris ","Jaime Gama, el temach y el escorpión dorado ",1,"Hayao Miyazaki","Me gusta mucho su arte",3,1,"5sos, maneskin y bring me the horizon ","Han impactado mi vida de alguna forma","Me gusta ver su crecimiento como banda ",3,0,0,0,0,0,0,0,0,0,"Instagram, Tik Tok, Youtube",2,"Me gusta su música, Me gusta cómo interactúan con sus seguidores","Que no suban nada o que los funen ",1,1,"Un giveaway ",2,0,0,2,0,1,0,0,0,2,2,2,2,2,"No compro merch pero me gustan los cassets ","Snacks, bebidas y a veces velas "
66,21,0,Soltero,"Tlalnepantla de Baz","Carrera técnica completa","Cecyt 6","Solo estudio","Yo pago por mis estudios",1,1,0,2,4,"Servicio de televisión por cable o satelital","Licenciatura Completa","3-4 personas","1-2 personas",3,"3-4 personas",3,0,1,1,1,1,0,0,3,"Recámara ",1,"Me gustan",L4D2,0,3,2,2,3,2,2,1,0,"Celular, PC",1,Rock,2,"Tarea, ejercicio, quehacer","Pop, Rock, Electrónica","onerepublic, twenty one pilots, royal blood","Me gustan","En casa, En la universidad, En el trabajo, En el transporte público, En transporte propio, Mientras hago ejercicio, En reuniones o fiestas",3,"YouTube Music, No utilizo plataformas de streaming para escuchar música",3,1,0,0,"Amigos, Redes sociales, Playlists o algoritmos de plataformas, Estaciones de radio","Videos cortos",1,"Letra y ritmo","Que cuenten una historia relacionada a la letra de la canción",1,0,1,3,3,0,YouTube,CdeCiencia,AriGameplays,1,Fútbol,"Es algo apasionante",5,1,OneRepublic,"Me identifico con su música o sus letras, Han impactado mi vida de alguna forma","Porque conectan conmigo",5,1,0,1,0,1,0,0,0,0,"Instagram, Facebook, Youtube, X",2,"Me gusta su música, Quiero estar al día con sus novedades, Me gustan sus contenidos exclusivos (videos, fotos, etc.)","Dejan de interesarme. ",0,0,"Firma de autógrafos",1,0,1,2,0,2,0,0,0,0,0,2,0,3,"Accesorios. ",Agua
67,22,1,Soltero,"Atizapán de Zaragoza ","Licenciatura Incompleta","UNITEC Campus Atizapán ","Estudio y trabajo medio tiempo","Yo pago por mis estudios",1,3,2,4,4,"Suscripción a plataformas de streaming de video (Netflix, Disney+, etc.), Suscripción a plataformas de streaming de música (Spotify, Apple Music, etc.)","Licenciatura Completa","3-4 personas","1-2 personas",4,"3-4 personas",3,0,2,3,1,3,1,1,3,"Cafeterías ",1,"Sin consumo","Call Of Duty",1,1,1,0,0,0,0,1,0,"X-box, Celular, PC",1,"De todo",3,"Tarea, Limpieza, Camniar","Pop, Kpop","Sabrina Carpenter, Morat y One Direction","Me gustan ","En casa, En la universidad, En el trabajo, En el transporte público, En transporte propio, Mientras hago ejercicio, En reuniones o fiestas",2,Spotify,3,1,1,2,"Familia, Amigos, Redes sociales, Playlists o algoritmos de plataformas, Colaboraciones con artistas que escucho, Espacios públicos","Pues recomendaciones",2,"El ritmo","Que tenga coherencia ",3,3,1,3,3,2,"Instagram, TikTok, YouTube",,,1,"Podcast y Artistas","Me gusta",2,1,"Sabrina Carpenter, One Direction, Itzy","Me identifico con su música o sus letras, Me gusta su estilo de vida o su historia personal, Por la interacción que tienen con los fans, Han impactado mi vida de alguna forma, Me gusta su imagen o estética","Me gustan ",5,0,0,0,0,2,0,2,3,0,"Instagram, Tik Tok, Facebook, Youtube, X",0,"Me gusta su música, Me gusta cómo interactúan con sus seguidores, Me gustan sus contenidos exclusivos (videos, fotos, etc.), Por las dinámicas o concursos que realizan","Sin motivos",0,0,"Conciertos en Mexico",2,2,2,2,0,2,0,0,0,3,3,2,2,2,Ninguno,"No entiendo la pregunta "
68,22,0,Soltero,Tlalpan,"Licenciatura Incompleta","Tec de Monterrey","Solo estudio","Mi padre/madre o tutor",1,3,1,2,3,"Servicio de televisión por cable o satelital, Suscripción a plataformas de streaming de video (Netflix, Disney+, etc.), Suscripción a plataformas de streaming de música (Spotify, Apple Music, etc.)","Licenciatura Completa","3-4 personas","1-2 personas",5,"1-2 personas",4,1,2,1,3,3,3,2,3,"Cine, bares, restaurantes",1,"Me entretienen por un largo tiempo","Parchis, Mario Party, Fortnite",0,3,3,1,0,3,2,2,2,"Nintendo, Celular",1,Pop,2,"Tarea,  bañarme, ejercicio, juegos, transportarme a la escuela","Pop, Rock, Kpop","Olivia Rodrigo, Tomorrow x Together, Ariana Grande","El ritmo de su musica y energia me da energia y me pone feliz","En casa, En el transporte público, En transporte propio, Mientras hago ejercicio, En reuniones o fiestas",3,"Apple Music",2,1,1,2,"Amigos, Redes sociales, Tendencias, Colaboraciones con artistas que escucho",-,2,"El ritmo, la producción, que tenga partes que se queden grabadas en mi cabeza","Un buen storyline, que no esté solo el cantante haciendo lipsync",3,3,3,2,2,3,"Instagram, TikTok, Twitter/X",,,1,"De distintos artistas","Me entretienen y me gustan sus propuestas musicales, ademas de que intentan conectaron su publico no solamente con contenido musical",5,1,"Olivia Rodrigo, Tomorrow x Together, Ariana Grande","Me identifico con su música o sus letras, Por la interacción que tienen con los fans, Han impactado mi vida de alguna forma, Me gusta su imagen o estética","El verlos en vivo me motiva a seguir escuchando su música",5,2,0,2,0,3,3,0,3,0,"Instagram, Tik Tok, Facebook, Youtube, X",0,"Me gusta su música, Quiero estar al día con sus novedades, Me gustan sus contenidos exclusivos (videos, fotos, etc.)","Si su música se vuelve mala",1,1,"Firmas de autógrafos como los artistas de antes, no solamente venta de estos en sus paginas",3,2,1,2,0,1,0,2,1,0,1,1,1,2,"Suscripciones a membresias de club de fans",Sabritas
69,22,1,Soltero,Tlalnepantla,"Licenciatura Completa",Unitec,"Estudio y trabajo medio tiempo","Mi padre/madre o tutor",1,2,2,2,4,"Servicio de televisión por cable o satelital, Suscripción a plataformas de streaming de video (Netflix, Disney+, etc.), Suscripción a plataformas de streaming de música (Spotify, Apple Music, etc.)","Licenciatura Completa","3-4 personas","1-2 personas",5,"3-4 personas",3,0,3,3,2,2,2,2,3,"El Gimnasio o museos ",0,"No me gustan ","Cuphead ",2,2,2,2,2,2,2,2,3,X-box,0,"No aplica",3,"Ejercicio , hacer tarea ,arreglo personal o al salir ","Pop, Rock, R&b","Los Mesoneros , Rels B y Ava Max ","Me gusta sus canciones y ritmo ","En casa, En la universidad, En el transporte público, En transporte propio, Mientras hago ejercicio",3,Spotify,3,0,0,0,"Familia, Playlists o algoritmos de plataformas, Estaciones de radio, Colaboraciones con artistas que escucho, Espacios públicos, Shazam o Soundhound","No hay otras ",2,"Las letras ","Que tenga que ver con la letra ",3,2,0,1,3,2,"Instagram, Facebook",,,1,"La natación y la música ","Desde chiquita me gustó porque era buena en el deporte ",4,1,"Los Mesoneros ","Me identifico con su música o sus letras, Han impactado mi vida de alguna forma","Me gusta el estilo de los artistas ",2,1,1,1,1,3,3,0,1,0,"Instagram, Facebook",0,"Me gusta su música, Me interesa su vida personal, Quiero estar al día con sus novedades, Me gusta cómo interactúan con sus seguidores, Me gustan sus contenidos exclusivos (videos, fotos, etc.), Por las dinámicas o concursos que realizan","El mal comportamiento que tienen con sus fans ",0,1,"Algo para entrar al Backstage",2,2,3,3,3,3,1,0,0,0,0,1,2,3,"Ningún otro","Barcel "
70,22,1,Soltero,"Miguel Hidalgo","Licenciatura Incompleta","Facultad de Ciencias Politicas y sociales","Estudio y trabajo medio tiempo","Yo pago por mis estudios",1,1,1,2,2,"Suscripción a plataformas de streaming de video (Netflix, Disney+, etc.), Suscripción a plataformas de streaming de música (Spotify, Apple Music, etc.)","Licenciatura Incompleta","1-2 personas","1-2 personas",5,"1-2 personas",2,1,3,2,0,3,2,2,3,"Cine, museos, parques nacionales, restaurantes",0,"no me llaman la atención",COD,0,1,0,0,0,0,0,0,0,"X-box, Celular",0,"No aplica",3,"Viajar en transporte, manejar, hacer tarea, hacer quehacer, bañarme, haciendo ejercicio.","Rock, Reggaeton, Corridos","Junior H, Raw Alejandro, My chemical romance","Me gusta el ritmo","En casa, En la universidad, En el trabajo, En el transporte público, En transporte propio, Mientras hago ejercicio, En reuniones o fiestas",3,"Spotify, YouTube Music, Amazon Music, Trebel",3,2,3,3,"Amigos, Redes sociales, Playlists o algoritmos de plataformas, Estaciones de radio, Tendencias, Colaboraciones con artistas que escucho, Espacios públicos","solo la escucho en la calle",3,"el ritmo y la  versatilidad con la que experimentan con el","los visuales",3,3,3,3,1,2,"Instagram, TikTok, Twitter/X, YouTube",,,1,Deporte,"Me gusta desde pequeña",5,1,"Junior H, Luis Miguel, Raw Alejandro","Me identifico con su música o sus letras, Por la interacción que tienen con los fans, Me gusta su imagen o estética","La independencia de su música",5,0,0,0,0,0,1,0,0,0,"Instagram, Tik Tok",0,"Me gusta su música, Me gustan sus contenidos exclusivos (videos, fotos, etc.), Por las dinámicas o concursos que realizan",Polemicas,0,1,"Listening Party",2,0,0,0,0,0,0,0,0,0,0,0,0,0,Ninguno,"Esta pregunta es muy ambigua"
71,22,1,Soltero,"Ixtapaluca ","Licenciatura Completa","Tecnológico de Monterrey ","No trabajo ni estudio actualmente",,1,2,1,2,4,"Suscripción a plataformas de streaming de video (Netflix, Disney+, etc.), Suscripción a plataformas de streaming de música (Spotify, Apple Music, etc.)","Licenciatura Incompleta","3-4 personas","1-2 personas",4,"1-2 personas",4,3,3,3,0,3,3,2,3,"Canchas deportivas, centro de entrenamiento de football, centros comerciales, plazas, parques y tiendas. ",0,"No son de mi interés ","Sin consumo",0,0,0,0,0,0,0,0,0,"Sin consumo",0,"Pop en inglés y alternativa ",1,"Bañarme, hacer ejercicio o ir en el carro","Pop, Electrónica, alternativa ","Olivia Rodrigo, Taylor Swift y Sabrina Carpenter","Me inspiran, me gustan y me identifico tanto con ellas como con las letras de sus canciones ","En casa, En transporte propio, Mientras hago ejercicio",3,"Apple Music",3,1,0,0,"Redes sociales, Estaciones de radio, Tendencias, Colaboraciones con artistas que escucho","Recomendaciones de personas en la plataforma X",2,"La letra principalmente y los ritmos ","Storytelling, producción, entretenimiento ",3,2,3,1,1,3,"Instagram, Twitter/X","@l_og2, Georgina Gigi y Julio López","No conozco a ninguno ",1,"Música, artistas, conciertos y festivales ","Me apasiona la música y asistir a los conciertos para escuchar las canciones es vivo y ver de cerca a mis artistas favoritos ",5,1,"Taylor Swift, Ariana Grande, Harry Styles","Me identifico con su música o sus letras, Por la interacción que tienen con los fans, Han impactado mi vida de alguna forma","Por su trayectoria en la industria, su forma de ser, las interacciones con fans,",5,1,0,0,0,1,0,0,0,0,"Instagram, Tik Tok, X",4,"Me gusta su música, Quiero estar al día con sus novedades, Me gustan sus contenidos exclusivos (videos, fotos, etc.)","Inactividad, falta de contenido, algún escándalo, malas actitudes suyas, contenido irrelevante a su carrera ",1,1,"Que siempre incluyan a LATAM en sus giras, hagan meet & greets no lucrativos, dinámica íntima para interactuar con verdaderos fans, paquetes VIP a precios razonables y con relación a calidad de beneficios - precio, mayor calidad en diseños de merch ",3,1,3,3,2,3,1,0,1,1,1,2,3,1,"Ropa, calzado o accesorios que hayan usado ","Escuchar música - iphone y airpods (Apple)
Hacer ejercicio - Adidas/Puma/New Balance "
72,22,1,Soltero,"Ecatepec ","Licenciatura Completa","Tecnológico de Monterrey CCM","Trabajo tiempo completo",,1,2,4,4,4,"Servicio de televisión por cable o satelital, Suscripción a plataformas de streaming de video (Netflix, Disney+, etc.), Suscripción a plataformas de streaming de música (Spotify, Apple Music, etc.)","Licenciatura Completa","3-4 personas","3-4 personas",6,"3-4 personas",3,1,1,2,1,3,2,2,3,"Cafeterías/restaurantes ",0,"Requieren mucho tiempo ","Sin consumo",0,0,0,0,0,0,0,0,0,"Sin consumo",0,"Rock/Indie ",3,"Trabajar en oficina, manejar, navegar por internet ","Pop, Kpop, Punk","BTS, Wallows y Pierce the veil ","BTS: Me gusta su versatilidad de estilos 
Wallows: Me gusta como incorporan el indie y un poco de pop 
Pierce the veil: Me gustan sus letras  ","En casa, En el trabajo, En transporte propio, En reuniones o fiestas",3,"Spotify, YouTube Music",3,2,2,3,"Amigos, Redes sociales, Playlists o algoritmos de plataformas, Estaciones de radio, Tendencias, Colaboraciones con artistas que escucho","Series o películas ",3,"Su letra y los ritmos que usan ","Los visuales o efectos ",3,3,3,2,2,3,"TikTok, Twitter/X","Emma Chamberlain, Maria Bottle y Yesly","Ian Orozco, Tammy Parra y Abelardo Bobadilla ",1,"La música ","Es algo que siempre está presente en nuestras vidas y sirve como una manera de expresión muy artística y creativa ",5,1,"BTS, wallows y pierce the veil","Me identifico con su música o sus letras, Me gusta su estilo de vida o su historia personal, Por la interacción que tienen con los fans, Han impactado mi vida de alguna forma, Me gusta su imagen o estética","Versatilidad de música, conceptos musicales, estrategias de marketing y personalidades de los artistas ",5,3,2,1,0,1,2,0,2,0,"Instagram, Tik Tok, Facebook, Youtube, X",4,"Me gusta su música, Me interesa su vida personal, Quiero estar al día con sus novedades, Me gustan sus contenidos exclusivos (videos, fotos, etc.)","Inactividad ",1,1,"M&G o giveaways de merch ",3,3,2,2,1,1,0,2,2,1,2,2,2,3,Ninguno,"Spotify, Youtube, Starbucks"
73,22,1,Soltero,Tlalpan,"Licenciatura Incompleta",UNAM,"Solo estudio","Mi padre/madre o tutor",1,3,3,5,5,"Servicio de televisión por cable o satelital, Suscripción a plataformas de streaming de video (Netflix, Disney+, etc.), Suscripción a plataformas de streaming de música (Spotify, Apple Music, etc.)","Licenciatura Incompleta","5 o más personas","5 o más personas",2,"1-2 personas",3,0,1,3,0,2,0,0,3,"Museos, La Roma ",0,"No le gustan, no le gusta estar frente a una pantalla jugando","Sin consumo",0,0,0,0,0,0,0,0,0,"Sin consumo",0,Ninguna,3,"Salir ir a la tienda, hacer el super, en el transporte , mientras hace tarea, durante el quehacer, antes de dormir, ","Pop, Rock, Hiphop","Lady Gaga, Scorpions, Kanye West","Porque su música la activa, muy energíca y siente que va con su esencia como persona, que la representa.","En casa, En la universidad, En el transporte público, Mientras hago ejercicio",3,"Apple Music, YouTube Music",3,1,0,3,"Playlists o algoritmos de plataformas, Shazam o Soundhound, Las expuestas en su clase.","Por películas, los compositores de esas películas. Su compositor favorito es Adrian Vonziegler",2,"Los sonidos Bajos, los que llevan el ritmo, lo que sirve para bailar o las letras.","Los colores, es lo primero en llamar su atención, que haya bailarines en el vídeo musical, sin bailarines lo siente incompleto, que tenga una historia.",3,0,0,3,0,3,Instagram,"María Bottle, Sabina de la Cruz y In.Templum.ophelia","Majo Rivas, Tae Kim y Kenia Os, Jair Sánchez, Yeri Mua, ",1,"Moda, Hip Hop, la cocina, Justin Bieber, Del océano, De la música caribeña y africana, instrumentos de cuerda","Los instrumentos de cuerdas porque los relaciona con el cielo, Justin Bieber porque formo parte de su infancia creciendo con el, el océano porque siente una conexión espiritual, de la cocina le hace más feliz cocinarle a la gente que a sí misma como un lenguaje de amor, de la moda porque siente que su parte más honesta la expresa con la ropa y le hace feliz ver a la gente expresarse con la ropa y le hace feliz la historia de la moda.",5,1,"BTS, Tinashe, Justin Bieber ","Me identifico con su música o sus letras, Me gusta su estilo de vida o su historia personal, Han impactado mi vida de alguna forma","Porque influyeron lo que estudia y a lo que se quiere dedicar. Porque los 3 bailan y ella quería bailar, además los 3 bailan hip Hop y quiere alcanzar su nivel y presencia",5,0,0,0,0,0,0,0,0,0,"Instagram, Youtube",1,"Me gusta su música, Su imagen ","Por haber hecho una acción que no iba con sus valores. Le deja de gustar su música porque ya no encaja en su estilo de vida",1,0,"Meet & Greet como se hacía en los 2010",1,0,0,0,0,0,0,1,0,1,1,1,1,1,"Artículos de papelería, ej. Cuadernos, estuches, etc.","Cuando baila le gusta utilizar tenis Adidas,  cuando sale su labial Italia Deluxe Matte mouse, su iPhone."
74,22,1,Soltero,"Cuauhtémoc ","Licenciatura Incompleta","Universidad La Salle ","Solo estudio","Mi padre/madre o tutor",1,2,2,2,3,"Servicio de televisión por cable o satelital, Suscripción a plataformas de streaming de video (Netflix, Disney+, etc.), Suscripción a plataformas de streaming de música (Spotify, Apple Music, etc.)",Posgrado,"1-2 personas","1-2 personas",6,"1-2 personas",4,0,0,2,0,3,2,2,3,"Parques, restaurantes, y cafeterías ",0,"No me interesan ","Sin consumo",0,0,0,0,0,0,0,0,0,"Sin consumo",0,"No escucho. ",3,"Hacer tarea/trabajar, bañarme, caminar, leer, cocinar, ","Pop, Rock, Indie ","Harry Styles, One Direction, Chappell Roan  ","Me hacen muy feliz, tienen música muy interesante y entretenida. ","En casa, En la universidad, En el transporte público, En transporte propio, En reuniones o fiestas",3,Spotify,3,1,1,2,"Amigos, Redes sociales, Tendencias, Colaboraciones con artistas que escucho, Espacios públicos","En los recomendados similares que la plataforma me da de artistas que estoy escuchando ",3,"La letra ","Que sea entretenido y único ",3,3,3,2,2,2,"TikTok, Twitter/X","Maria Castañeda ","Creo que la gran mayoría. Los encuentro a todos muy superficiales, flojos, poco inteligentes, que viven en una nube de ignorancia y pierden el contacto con los demás. También muchas veces es contenido muy estúpido.  ",1,"Del cine y del terror","Porque considero que es una plataforma muy personal y excelente para exponer una historia o incluso para usarlo como conducto para demostrar algo. ",4,1,"Harry Styes, One Direction, Lorde ","Me identifico con su música o sus letras, Me gusta su estilo de vida o su historia personal, Por la interacción que tienen con los fans, Han impactado mi vida de alguna forma, Me gusta su imagen o estética","Porque me hacen feliz. ",5,3,0,2,0,3,0,2,3,0,"Instagram, Tik Tok, Facebook, Youtube, X",3,"Me interesa su vida personal, Quiero estar al día con sus novedades, Me gustan sus contenidos exclusivos (videos, fotos, etc.)","Que nunca suba nada o su contenido vaya en contra de mis valores. ",1,1,"Giveaways de merch oficial o pop ups de merch ",3,1,3,3,2,3,0,0,1,3,2,3,3,3,"Pósters,  sudaderas, camisas, llaveros,  tote bags ","Supongo Apple por el iPhone.  "
75,22,1,Soltero,Azcapotzalco,"Licenciatura Completa","Tecmilenio Ferreria ","Estudio y trabajo medio tiempo","Mi padre/madre o tutor",1,3,0,4,5,"Suscripción a plataformas de streaming de video (Netflix, Disney+, etc.), Suscripción a plataformas de streaming de música (Spotify, Apple Music, etc.)","Licenciatura Completa","5 o más personas","1-2 personas",1,"1-2 personas",4,0,2,2,0,1,2,1,3,"cafeterias ",0,"no me gustan ","Sin consumo",0,0,0,0,0,0,0,0,0,"Sin consumo",0,no,3,"todo lo hago con música ","Reggaeton, Salsa, Banda (Regional Mexicano)","Alfredo Olivas 
Julion Álvarez 
Wisin&Yandel","me gustan mucho ","En casa, En el transporte público, En transporte propio, Mientras hago ejercicio, En reuniones o fiestas",3,Spotify,3,1,2,2,"Familia, Amigos, Redes sociales, Tendencias, Espacios públicos, Shazam o Soundhound","solo de esas, o tiktok ",0,"la letras y ritmo ","el escenario y lo que da a fondo ",3,3,1,1,2,1,TikTok,"leans deeb, analista cruz ","no tengo ",1,"de las cafeterias y lugares tranquilos ","me genera paz ",5,1,"alfredo olivas, julion alvarez y grupo firme ","Han impactado mi vida de alguna forma","nada mas de ellos ",5,0,0,0,2,2,0,0,0,0,Instagram,2,"Me gusta su música, Me gusta cómo interactúan con sus seguidores, Por las dinámicas o concursos que realizan","que me deje de gustar su música ",0,0,"mas conciertos ",2,0,0,0,0,0,0,0,0,0,0,0,0,0,tazas,"apple, nike, epura"
76,22,1,Soltero,"Gustavo A. Maderl","Licenciatura Incompleta",UPIITA,"Estudio y trabajo medio tiempo","Yo pago por mis estudios",1,2,0,2,1,"Suscripción a plataformas de streaming de video (Netflix, Disney+, etc.), Suscripción a plataformas de streaming de música (Spotify, Apple Music, etc.)","Licenciatura Incompleta","1-2 personas","1-2 personas",1,"1-2 personas",1,0,1,2,0,1,0,0,3,Restaurantes,0,"No me gustan","Sin consumo",0,0,0,0,0,0,0,0,0,"Sin consumo",0,"No juego",3,"Ir en transporte ","Pop, Rock, Baladas","The killers, sobrina carpenter, the beatles","El ritmo","En casa, En la universidad, En el trabajo, En el transporte público, En transporte propio, En reuniones o fiestas",3,"Spotify, YouTube Music",3,1,3,1,"Familia, Amigos, Redes sociales, Playlists o algoritmos de plataformas, Colaboraciones con artistas que escucho","Escuela ",1,Originalidad,"Contenido ",3,1,0,2,3,2,"Instagram, YouTube",Ninguno,Ninguno,0,"Sin fanatismo","No aplica",0,0,"Sin fanatismo",,"Sin motivos",0,0,0,0,0,0,0,0,0,0,,0,"No aplica","Sin motivos",0,0,"Sin dinamica",0,0,0,0,0,0,0,0,0,0,0,0,0,0,Ninguno,Nose
